{
  "schemaVersion": 1,
  "campaign": "Ford Manufacturer Campaign Phase 2B",
  "generatedAt": "2026-10-07",
  "candidatePool": {
    "total": 54,
    "stableOfficialDesignations": 15,
    "enrichmentCandidates": 37,
    "officialPartnerDesignations": [
      "BDA",
      "YBB"
    ]
  },
  "outcomeCounts": {
    "implemented": 5,
    "readyButDuplicate": 0,
    "holdMissingConstruction": 6,
    "holdMissingPerformance": 4,
    "holdMissingApplicationScope": 37,
    "holdIdentityAmbiguous": 2,
    "holdSourceConflict": 0,
    "notProductionEligible": 0
  },
  "candidates": [
    {
      "candidateId": "ford-australia-boss-335",
      "officialDesignation": "Boss 335",
      "relationship": "fordDesigned",
      "partner": null,
      "applications": [
        "FPV GT"
      ],
      "years": {
        "start": null,
        "end": null,
        "approximate": true
      },
      "markets": [
        "Australia/New Zealand"
      ],
      "category": "passengerVehicle",
      "construction": {
        "displacementCc": 4951,
        "configuration": "V",
        "cylinderCount": 8,
        "valvesTotal": null,
        "camshaftsTotal": null,
        "fuel": "petrol",
        "aspiration": "supercharged",
        "injection": null
      },
      "performance": null,
      "sourceRefs": [
        "ford-heritage-vault"
      ],
      "exactEvidenceLocations": [
        "Phase 1 points only to the Ford Heritage Vault landing archive; no candidate-specific page or section binds an exact code/application."
      ],
      "outcome": "holdMissingApplicationScope",
      "holdReason": "Existing research does not bind a safe exact application and complete year interval; technical fields also remain incomplete, so no production scope can be formed.",
      "productionRecordId": null,
      "duplicateOf": null,
      "limitationNotes": [
        "The registered source is an archive-level discovery lead and does not publish candidate-specific identity evidence.",
        "Missing next fields: exactCode, codeApplicationBinding, documentedYears."
      ]
    },
    {
      "candidateId": "ford-barra-182",
      "officialDesignation": "Barra 182",
      "relationship": "fordDesigned",
      "partner": null,
      "applications": [
        "Ford Falcon BA"
      ],
      "years": {
        "start": null,
        "end": null,
        "approximate": true
      },
      "markets": [
        "Australia/New Zealand"
      ],
      "category": "passengerVehicle",
      "construction": {
        "displacementCc": 3984,
        "configuration": "inline",
        "cylinderCount": 6,
        "valvesTotal": null,
        "camshaftsTotal": null,
        "fuel": "petrol",
        "aspiration": "naturallyAspirated",
        "injection": null
      },
      "performance": null,
      "sourceRefs": [
        "ford-heritage-vault"
      ],
      "exactEvidenceLocations": [
        "Phase 1 points only to the Ford Heritage Vault landing archive; no candidate-specific page or section binds an exact code/application."
      ],
      "outcome": "holdMissingApplicationScope",
      "holdReason": "Existing research does not bind a safe exact application and complete year interval; technical fields also remain incomplete, so no production scope can be formed.",
      "productionRecordId": null,
      "duplicateOf": null,
      "limitationNotes": [
        "The registered source is an archive-level discovery lead and does not publish candidate-specific identity evidence.",
        "Missing next fields: exactCode, codeApplicationBinding, documentedYears."
      ]
    },
    {
      "candidateId": "ford-barra-240t",
      "officialDesignation": "Barra 240T",
      "relationship": "fordDesigned",
      "partner": null,
      "applications": [
        "Ford Falcon XR6 Turbo BA"
      ],
      "years": {
        "start": null,
        "end": null,
        "approximate": true
      },
      "markets": [
        "Australia/New Zealand"
      ],
      "category": "passengerVehicle",
      "construction": {
        "displacementCc": 3984,
        "configuration": "inline",
        "cylinderCount": 6,
        "valvesTotal": null,
        "camshaftsTotal": null,
        "fuel": "petrol",
        "aspiration": "turbocharged",
        "injection": null
      },
      "performance": null,
      "sourceRefs": [
        "ford-heritage-vault"
      ],
      "exactEvidenceLocations": [
        "Phase 1 points only to the Ford Heritage Vault landing archive; no candidate-specific page or section binds an exact code/application."
      ],
      "outcome": "holdMissingApplicationScope",
      "holdReason": "Existing research does not bind a safe exact application and complete year interval; technical fields also remain incomplete, so no production scope can be formed.",
      "productionRecordId": null,
      "duplicateOf": null,
      "limitationNotes": [
        "The registered source is an archive-level discovery lead and does not publish candidate-specific identity evidence.",
        "Missing next fields: exactCode, codeApplicationBinding, documentedYears."
      ]
    },
    {
      "candidateId": "ford-barra-270t",
      "officialDesignation": "Barra 270T",
      "relationship": "fordDesigned",
      "partner": null,
      "applications": [
        "Ford Falcon XR6 Turbo FG"
      ],
      "years": {
        "start": null,
        "end": null,
        "approximate": true
      },
      "markets": [
        "Australia/New Zealand"
      ],
      "category": "passengerVehicle",
      "construction": {
        "displacementCc": 3984,
        "configuration": "inline",
        "cylinderCount": 6,
        "valvesTotal": null,
        "camshaftsTotal": null,
        "fuel": "petrol",
        "aspiration": "turbocharged",
        "injection": null
      },
      "performance": null,
      "sourceRefs": [
        "ford-heritage-vault"
      ],
      "exactEvidenceLocations": [
        "Phase 1 points only to the Ford Heritage Vault landing archive; no candidate-specific page or section binds an exact code/application."
      ],
      "outcome": "holdMissingApplicationScope",
      "holdReason": "Existing research does not bind a safe exact application and complete year interval; technical fields also remain incomplete, so no production scope can be formed.",
      "productionRecordId": null,
      "duplicateOf": null,
      "limitationNotes": [
        "The registered source is an archive-level discovery lead and does not publish candidate-specific identity evidence.",
        "Missing next fields: exactCode, codeApplicationBinding, documentedYears."
      ]
    },
    {
      "candidateId": "ford-barra-ecolpi",
      "officialDesignation": "EcoLPi Barra",
      "relationship": "fordDesigned",
      "partner": null,
      "applications": [
        "Ford Falcon FG"
      ],
      "years": {
        "start": null,
        "end": null,
        "approximate": true
      },
      "markets": [
        "Australia/New Zealand"
      ],
      "category": "passengerVehicle",
      "construction": {
        "displacementCc": 3984,
        "configuration": "inline",
        "cylinderCount": 6,
        "valvesTotal": null,
        "camshaftsTotal": null,
        "fuel": "lpg",
        "aspiration": "naturallyAspirated",
        "injection": null
      },
      "performance": null,
      "sourceRefs": [
        "ford-heritage-vault"
      ],
      "exactEvidenceLocations": [
        "Phase 1 points only to the Ford Heritage Vault landing archive; no candidate-specific page or section binds an exact code/application."
      ],
      "outcome": "holdMissingApplicationScope",
      "holdReason": "Existing research does not bind a safe exact application and complete year interval; technical fields also remain incomplete, so no production scope can be formed.",
      "productionRecordId": null,
      "duplicateOf": null,
      "limitationNotes": [
        "The registered source is an archive-level discovery lead and does not publish candidate-specific identity evidence.",
        "Missing next fields: exactCode, codeApplicationBinding, documentedYears."
      ]
    },
    {
      "candidateId": "ford-cleveland-351c",
      "officialDesignation": "351 Cleveland",
      "relationship": "fordDesigned",
      "partner": null,
      "applications": [
        "Ford Mustang",
        "Ford Falcon"
      ],
      "years": {
        "start": null,
        "end": null,
        "approximate": true
      },
      "markets": [
        "North America",
        "Australia/New Zealand"
      ],
      "category": "passengerVehicle",
      "construction": {
        "displacementCc": 5752,
        "configuration": "V",
        "cylinderCount": 8,
        "valvesTotal": null,
        "camshaftsTotal": null,
        "fuel": "petrol",
        "aspiration": "naturallyAspirated",
        "injection": null
      },
      "performance": null,
      "sourceRefs": [
        "ford-heritage-vault"
      ],
      "exactEvidenceLocations": [
        "Phase 1 points only to the Ford Heritage Vault landing archive; no candidate-specific page or section binds an exact code/application."
      ],
      "outcome": "holdMissingApplicationScope",
      "holdReason": "Existing research does not bind a safe exact application and complete year interval; technical fields also remain incomplete, so no production scope can be formed.",
      "productionRecordId": null,
      "duplicateOf": null,
      "limitationNotes": [
        "The registered source is an archive-level discovery lead and does not publish candidate-specific identity evidence.",
        "Missing next fields: exactCode, codeApplicationBinding, documentedYears."
      ]
    },
    {
      "candidateId": "ford-cologne-v6-2800",
      "officialDesignation": "2.8 Cologne V6",
      "relationship": "fordDesigned",
      "partner": null,
      "applications": [
        "Ford Capri",
        "Ford Granada",
        "Ford Bronco II"
      ],
      "years": {